{"actual_distribution_activation":"PENDING_SIGNOFF","artifact_metadata":{"classification":"SYNTHETIC_FIXTURE","evidence_claim":"NOT_EVIDENCE_OR_PASS","fixture_notice":"SYNTHETIC EXAMPLE ONLY; NOT EVIDENCE; NOT A PASS VERDICT"},"assessed_by_role":"build-platform-owner","closed_at":"2026-06-01T13:08:00Z","controller_deployment_ref":{"artifact_id":"fixture-production-deployment-record","artifact_path":"contracts/fixtures/governance-models/support/fixture-production-deployment-record.json","artifact_sha256":"3b68d6b539ed8a386aabe9efb3f5eb7d661d1fb8d606718ed708f12a4c9d9c73","revision":1,"schema":"ylx.production-deployment-record.v1"},"credential_authority_ref":{"artifact_path":"contracts/fixtures/governance-models/valid/owner-assignment-v2-planning.json","artifact_sha256":"089fd1c73350b99c8a67f96ab2a1241a713ca6decbdf142280e65370a3d2966d","authority_id":"fixture-v2-planning-owner-assignment","revision":1,"verified_at":"2026-06-01T13:00:00Z"},"customer_profile_verdict_ref":{"artifact_id":"fixture-terminal-result-v2-sec-customer-01","artifact_path":"contracts/fixtures/governance-models/valid/stage-terminal-result-v2-sec-customer-01.json","artifact_sha256":"bd865cf0ef94b5d0e22b3941d70c72372941b85371570163b658c4b0c8a9ae5f","revision":1,"schema":"ylx.stage-terminal-result.v2"},"customer_visibility":"QUARANTINED","distribution_drill_ref":{"artifact_id":"fixture-release-distribution-drill-v1","artifact_path":"contracts/fixtures/governance-models/valid/release-distribution-drill.json","artifact_sha256":"aa2642cb77bee4ab07a85ba325ba5df428f66613b0627fd4273ba9702afe97c8","revision":1,"schema":"ylx.release-distribution-drill.v1"},"effective_m4_lineage_ref":{"artifact_id":"fixture-m4-context-lineage-v2","artifact_path":"contracts/fixtures/governance-models/valid/m4-context-lineage-r2.json","artifact_sha256":"11f6d820b383c384ca3ab18d8eb66098c90842747d5de89e54c2cef4f60aa63c","revision":2,"schema":"ylx.m4-context-lineage.v1"},"m5_binding_context_ref":{"artifact_id":"fixture-binding-context-v2-m5","artifact_path":"contracts/fixtures/governance-models/valid/binding-context-v2-m5.json","artifact_sha256":"763f34fcb78fae4d4de0473fe500220e7bec310d5f61799f7a44f378c27747e3","revision":1,"schema":"ylx.binding-context.v2"},"predecessor_readiness_ref":null,"production_storage_verdict_refs":[{"artifact_id":"fixture-terminal-result-v2-store-iam-01","artifact_path":"contracts/fixtures/governance-models/valid/stage-terminal-result-v2-store-iam-01.json","artifact_sha256":"610949b09a449a6741f8b5bb7c6416e9ee7907eee635632a455620ea4e11743c","revision":1,"schema":"ylx.stage-terminal-result.v2"},{"artifact_id":"fixture-terminal-result-v2-store-cors-01","artifact_path":"contracts/fixtures/governance-models/valid/stage-terminal-result-v2-store-cors-01.json","artifact_sha256":"f441ffe7650b0a379a7d9dfde7a59a09dce00228dfb2491d1a0a3f8fb37a9dce","revision":1,"schema":"ylx.stage-terminal-result.v2"},{"artifact_id":"fixture-terminal-result-v2-store-lifecycle-01","artifact_path":"contracts/fixtures/governance-models/valid/stage-terminal-result-v2-store-lifecycle-01.json","artifact_sha256":"934aa9aebaeb8d4675b30b96e4e7b3857b71aa626d8f36264ee150fa4e840fb5","revision":1,"schema":"ylx.stage-terminal-result.v2"},{"artifact_id":"fixture-terminal-result-v2-store-first-publish-01","artifact_path":"contracts/fixtures/governance-models/valid/stage-terminal-result-v2-store-first-publish-01.json","artifact_sha256":"673ce02219d8131c563f9934e37b27d7c8055063ed36b30371216c44c91d4299","revision":1,"schema":"ylx.stage-terminal-result.v2"}],"readiness_checks":{"active_distribution_not_used_as_evidence":true,"customer_profile_auth_rerun_passed":true,"customer_visibility_quarantined":true,"distribution_drill_passed":true,"effective_m4_lineage_exact":true,"production_credentials_bound":true,"production_service_identity_bound":true,"production_storage_and_cas_bound":true,"production_storage_verdicts_passed":true,"release_bundle_exact":true,"rendered_config_and_deployment_bound":true,"rollback_and_recovery_passed":true,"same_qualified_controller_build":true,"same_qualified_resolver_build":true,"visibility_authority_bound":true,"writer_disabled":true},"readiness_id":"fixture-production-deployment-readiness","readiness_result":"READY_FOR_RELEASE_ATTEMPT","release_bundle_sha256":"cb896e0ff8d05adb600ce9127992c05037d5480122124b6d1b7f62f51e5f44ea","requirement_id":"BUILD-DEPLOY-01","resolver_deployment_ref":{"artifact_id":"fixture-production-deployment-record","artifact_path":"contracts/fixtures/governance-models/support/fixture-production-deployment-record.json","artifact_sha256":"3b68d6b539ed8a386aabe9efb3f5eb7d661d1fb8d606718ed708f12a4c9d9c73","revision":1,"schema":"ylx.production-deployment-record.v1"},"result":"PASS","reviewed_by_role":"qa-evidence-owner","revision":1,"schema":"ylx.production-deployment-readiness.v1","service_authority_ref":{"artifact_path":"contracts/fixtures/governance-models/valid/owner-assignment-v2-planning.json","artifact_sha256":"089fd1c73350b99c8a67f96ab2a1241a713ca6decbdf142280e65370a3d2966d","authority_id":"fixture-v2-planning-owner-assignment","revision":1,"verified_at":"2026-06-01T13:00:00Z"},"storage_authority_ref":{"artifact_path":"contracts/fixtures/governance-models/valid/owner-assignment-v2-planning.json","artifact_sha256":"089fd1c73350b99c8a67f96ab2a1241a713ca6decbdf142280e65370a3d2966d","authority_id":"fixture-v2-planning-owner-assignment","revision":1,"verified_at":"2026-06-01T13:00:00Z"},"visibility_authority_ref":{"artifact_path":"contracts/fixtures/governance-models/valid/owner-assignment-v2-planning.json","artifact_sha256":"089fd1c73350b99c8a67f96ab2a1241a713ca6decbdf142280e65370a3d2966d","authority_id":"fixture-v2-planning-owner-assignment","revision":1,"verified_at":"2026-06-01T13:00:00Z"}}